### ISSUE TITLE
routed and ipvlan nic requires proxy_ndp enabled for all interfaces for reliable IPv6

### ISSUE THREAD

**Issue by tomponline** [lxc/lxd#6668]
The LXD NIC types `routed` and `ipvlan` rely on proxy NDP in the Linux kernel in order to advertise a container's IPv6 addresses onto the parent's network without using a bridge.

At a minimal this works by enabling `proxy_ndp` on both the parent interface (for ipvlan and routed modes) and the container's parent veth interface (for routed mode only).

However I have noticed that there appears to be periodic short periods of high latency approximately every 15-20s which is ultimately caused by not having `sysctl net.ipv6.conf.all.proxy_ndp=1` enabled.

Here is a packet trace pinging a container with a `routed` NIC from another host with `sysctl net.ipv6.conf.all.proxy_ndp=0`:

```
16:19:42.030228 IP6 fe80::fc00:2ff:fe7b:13c4 > 2001:xxxx:7402:1f06::2: ICMP6, neighbor solicitation, who has 2001:xxxx:7402:1f06::2, length 32
16:19:42.030438 IP6 fe80::5400:2ff:fe7b:13c4 > fe80::fc00:2ff:fe7b:13c4: ICMP6, destination unreachable, beyond scope 2001:xxxx:7402:1f06::2, source address fe80::fc00:2ff:fe7b:13c4, length 80
16:19:43.054211 IP6 fe80::fc00:2ff:fe7b:13c4 > 2001:xxxx:7402:1f06::2: ICMP6, neighbor solicitation, who has 2001:xxxx:7402:1f06::2, length 32
16:19:43.054269 IP6 fe80::5400:2ff:fe7b:13c4 > fe80::fc00:2ff:fe7b:13c4: ICMP6, destination unreachable, beyond scope 2001:xxxx:7402:1f06::2, source address fe80::fc00:2ff:fe7b:13c4, length 80
16:19:44.078206 IP6 fe80::fc00:2ff:fe7b:13c4 > 2001:xxxx:7402:1f06::2: ICMP6, neighbor solicitation, who has 2001:xxxx:7402:1f06::2, length 32
16:19:44.078263 IP6 fe80::5400:2ff:fe7b:13c4 > fe80::fc00:2ff:fe7b:13c4: ICMP6, destination unreachable, beyond scope 2001:xxxx:7402:1f06::2, source address fe80::fc00:2ff:fe7b:13c4, length 80
16:19:45.871371 IP6 fe80::fc00:2ff:fe7b:13c4 > ff02::1:ff00:2: ICMP6, neighbor solicitation, who has 2001:xxxx:7402:1f06::2, length 32
16:19:46.263519 IP6 fe80::5400:2ff:fe7b:13c4 > fe80::fc00:2ff:fe7b:13c4: ICMP6, neighbor advertisement, tgt is 2001:xxxx:7402:1f06::2, length 32
```

After the initial proxy NDP has worked and the neighbour has resolved the container's MAC address as the host's (proxy NDP is working), then packets begin to flow normally.

However periodically the neighbour makes a neighbor solicitation request to the unicast address being proxied (2001:xxxx:7402:1f06::2). The host then responds with "destination unreachable, beyond scope 2001:xxxx:7402:1f06::2, source address fe80::fc00:2ff:fe7b:13c4".

This is tried several times, before the neighbour then retries the request, but this time to the multicast link-local broadcast address "ff02::1:ff00:2". At this point the neighbour appears to have invalidated its neighbour cache for 2001:xxxx:7402:1f06::2 and stops routing packets temporarily.

The LXD host kernel now correctly responds with the expected proxy NDP neighbour advertisements.

This all takes place quickly, <1s, but it means periodically there is a noticeable delay of 300-700ms for packets whilst this new NDP resolution takes place.

So proxy NDP is working, but not when the neighbour makes a unicast solicitation, only when making multicast solicitations.

Strangely though, enabling `sysctl net.ipv6.conf.all.proxy_ndp=1` on the LXD host fixes this and causes correct response to unicast solicitations. This prevents the neighbour cache entry on the router from being expired and avoids delaying packets whilst a fresh NDP resolution takes place.

I am unsure why this is needed.

Proposed fix:

1. Update `ipvlan` and `routed` NIC type documentation to indicate that  `sysctl net.ipv6.conf.all.proxy_ndp=1` should be set.
2. Update code to check for `sysctl net.ipv6.conf.all.proxy_ndp=1` and fail to start container if not set.

**Comment by tomponline** [comment]
Further investigation confirm IPVLAN nic type is not affected by this issue.
