### ISSUE TITLE
LXC enforcing TLS 1.3 - docs incorrect, env variable not working, and too strict

### ISSUE THREAD

**Issue by adjenks** [lxc/lxd#11504]
# Required information

 * Distribution: Rocky Linux
 * Distribution version: 9.1
 * `lxc--version`: I was using 5.12 but I switched to 4.0.9 to solve the problem.

# Issue description

When trying to run `lxc image list images:` I get the error: 

> Error: Failed parsing stream: Get "https://images.linuxcontainers.org/streams/v1/index.json": tls: server selected unsupported protocol version 303

303 [indicates](https://support.citrix.com/article/CTX219332/netscaler-tlsssl-redirect-based-on-ssl-version) TLS1.2

I tried to set the environment to allow 1.2 but it doesn't work:

```
[Service]
Environment=LXD_INSECURE_TLS=true
```
In the documentation for version 5 it says that TLS 1.2 or greater is enforced: https://linuxcontainers.org/lxd/docs/stable-5.0/authentication/#communication-protocol

However the code for version 5 enforces 1.3: https://github.com/lxc/lxd/blob/130c788f70f9c945b068241ad214218a46a0f04d/shared/network.go#L71

So the "latest" documentation and the code do not agree.

images.linuxcontainers.org might support TLS 1.3, but my system is behind a corporate firewall, so there is TLS inspection and the TLS communications are currently stuck at version 1.2. Version 1.2 is not considered unsafe, however the latest LXC client demands it and the systemd service config doesn't seem to have an effect.

I can roll back to version 4 of the lxc snap package and everything works fine. No TLS errors.

I believe that:
1. The documentation should be fixed.
2. TLS 1.2 should be allowed by default.
3. The environment variable should work, and should specify the minimum version, allowing you to lower or increase it, instead of just letting you go from 1.3 to 1.2.

# Steps to reproduce

 1. Install version 5 of lxc
 5. Try to list images from a remote server that does not support TLS 1.3 yet.

# Other

Thank you for your time.

**Comment by simondeziel** [comment]
@adjenks I don't have an easy way to do a real test but when I do `LXD_INSECURE_TLS=true lxc image ls images:`, wireshark shows the Client Hello packet contains:

```
Frame 8: 360 bytes on wire (2880 bits), 360 bytes captured (2880 bits)
Ethernet II, Src: IntelCor_5e:7b:21 (e4:a4:71:5e:7b:21), Dst: Netgear_10:eb:b1 (34:98:b5:10:eb:b1)
Internet Protocol Version 6, Src: 2001:470:b1c3:7947:d43:4157:e0eb:32de, Dst: 2602:fc62:a:1::8
Transmission Control Protocol, Src Port: 54360, Dst Port: 443, Seq: 1, Ack: 1, Len: 274
Transport Layer Security
    TLSv1.3 Record Layer: Handshake Protocol: Client Hello
        Content Type: Handshake (22)
        Version: TLS 1.0 (0x0301)
        Length: 269
        Handshake Protocol: Client Hello
            Handshake Type: Client Hello (1)
            Length: 265
            Version: TLS 1.2 (0x0303)
            Random: 15c06debdf1362d68a9d482121727525f193e121d0b7bdd919e490a69ab6d910
            Session ID Length: 32
            Session ID: 77d2e071c9e222119751d718929f56de7e6ac55c1b025004db5f362b10eb47d3
            Cipher Suites Length: 38
            Cipher Suites (19 suites)
            Compression Methods Length: 1
            Compression Methods (1 method)
            Extensions Length: 154
            Extension: server_name (len=31)
            Extension: status_request (len=5)
            Extension: supported_groups (len=10)
            Extension: ec_point_formats (len=2)
            Extension: signature_algorithms (len=26)
            Extension: renegotiation_info (len=1)
            Extension: signed_certificate_timestamp (len=0)
            Extension: supported_versions (len=5)
                Type: supported_versions (43)
                Length: 5
                Supported Versions length: 4
                Supported Version: TLS 1.3 (0x0304)
                Supported Version: TLS 1.2 (0x0303)
            Extension: key_share (len=38)
            [JA3 Fullstring: 771,49195-49199-49196-49200-52393-52392-49161-49171-49162-49172-156-157-47-53-49170-10-4865-4866-4867,0-5-10-11-13-65281-18-43-51,29-23-24-25,0]
            [JA3: 473cd7cb9faa642487833865d516e578]
```

If however, I omit the `LXD_INSECURE_TLS` variable, I get the following:

```
Frame 10: 358 bytes on wire (2864 bits), 358 bytes captured (2864 bits)
Ethernet II, Src: IntelCor_5e:7b:21 (e4:a4:71:5e:7b:21), Dst: Netgear_10:eb:b1 (34:98:b5:10:eb:b1)
Internet Protocol Version 6, Src: 2001:470:b1c3:7947:d43:4157:e0eb:32de, Dst: 2602:fc62:a:1::8
Transmission Control Protocol, Src Port: 53854, Dst Port: 443, Seq: 1, Ack: 1, Len: 272
Transport Layer Security
    TLSv1.3 Record Layer: Handshake Protocol: Client Hello
        Content Type: Handshake (22)
        Version: TLS 1.0 (0x0301)
        Length: 267
        Handshake Protocol: Client Hello
            Handshake Type: Client Hello (1)
            Length: 263
            Version: TLS 1.2 (0x0303)
            Random: 41fa5417a774fad421399f5eda8cda1484663e42a42d8f396e0398f63b551f37
            Session ID Length: 32
            Session ID: 3daa57e8df542c200f4af0645bfab5a80c76aa6d1cbbd2685d64e016444199d0
            Cipher Suites Length: 38
            Cipher Suites (19 suites)
            Compression Methods Length: 1
            Compression Methods (1 method)
            Extensions Length: 152
            Extension: server_name (len=31)
            Extension: status_request (len=5)
            Extension: supported_groups (len=10)
            Extension: ec_point_formats (len=2)
            Extension: signature_algorithms (len=26)
            Extension: renegotiation_info (len=1)
            Extension: signed_certificate_timestamp (len=0)
            Extension: supported_versions (len=3)
                Type: supported_versions (43)
                Length: 3
                Supported Versions length: 2
                Supported Version: TLS 1.3 (0x0304)
            Extension: key_share (len=38)
            [JA3 Fullstring: 771,49195-49199-49196-49200-52393-52392-49161-49171-49162-49172-156-157-47-53-49170-10-4865-4866-4867,0-5-10-11-13-65281-18-43-51,29-23-24-25,0]
            [JA3: 473cd7cb9faa642487833865d516e578]
```

That said, our doc for 5.0 is wrong and I'll send a PR to fix it soon. This was probably due to us changing the TLS requirement at the last minute prior to cutting 5.0.

**Comment by stgraber** [comment]
Right, the logic is simply:
```
»···// Restrict to TLS 1.3 unless LXD_INSECURE_TLS is set.
»···if IsFalseOrEmpty(os.Getenv("LXD_INSECURE_TLS")) {
»···»···config.MinVersion = tls.VersionTLS13
»···} else {
»···»···config.MinVersion = tls.VersionTLS12
»···}
```

**Comment by stgraber** [comment]
@simondeziel I sent a fix

**Comment by adjenks** [comment]
Thank you for updating the documentation, I was unaware I had to set the variable on both the client and the server. I was only setting it in the service configuration at `/etc/systemd/system/snap.lxd.daemon.service.d/override.conf` via ` systemctl edit snap.lxd.daemon`, which wasn't enough.
