### ISSUE TITLE
Container can't reach its own service using host's DNAT address

### ISSUE THREAD

**Issue by gianpietro1** [lxc/lxd#2976]
# Issue
My LXD container (10.0.10.230) serves locally at port 8443.  From the host, I can access that IP Address and service, and for external devices I have a DNAT rule with the external host IP Address (192.168.1.254):

DNAT       tcp  --  anywhere             192.168.1.254        tcp dpt:8443 to:10.0.10.230

Problem is, LXD container can't access the service using the external host IP Address, and that breaks the application inside the container. In summary:

External hosts to 192.168.1.254:8443  --> WORKS
Host to 192.168.1.254:8443 --> WORKS
Host to 10.0.10.230:8443 --> WORKS
Container to 10.0.10.230:8443 --> WORKS
Container to 192.168.1.254:8443 --> FAILS

I don't have iptables filters configured and I'm not sure where else to look at.

Some tcpdump debugging took from lxdbr0 interface at the host shows packets flowing correctly:

11:37:47.330534 IP (tos 0x10, ttl 64, id 21869, offset 0, flags [DF], proto TCP (6), length 60)
    10.0.10.230.37518 > 192.168.1.254.8443: Flags [S], cksum 0xd7ba (incorrect -> 0xe4b5), seq 3143892755, win 29200, options [mss 1460,sackOK,TS val 19835518 ecr 0,nop,wscale 7], length 0
11:37:47.330561 IP (tos 0x10, ttl 63, id 21869, offset 0, flags [DF], proto TCP (6), length 60)
    10.0.10.230.37518 > 10.0.10.230.8443: Flags [S], cksum 0x29fa (incorrect -> 0x9276), seq 3143892755, win 29200, options [mss 1460,sackOK,TS val 19835518 ecr 0,nop,wscale 7], length 0
11:37:48.333748 IP (tos 0x10, ttl 64, id 21870, offset 0, flags [DF], proto TCP (6), length 60)
    10.0.10.230.37518 > 192.168.1.254.8443: Flags [S], cksum 0xd7ba (incorrect -> 0xe3ba), seq 3143892755, win 29200, options [mss 1460,sackOK,TS val 19835769 ecr 0,nop,wscale 7], length 0
11:37:48.333801 IP (tos 0x10, ttl 63, id 21870, offset 0, flags [DF], proto TCP (6), length 60)
    10.0.10.230.37518 > 10.0.10.230.8443: Flags [S], cksum 0x29fa (incorrect -> 0x917b), seq 3143892755, win 29200, options [mss 1460,sackOK,TS val 19835769 ecr 0,nop,wscale 7], length 0
11:37:50.337701 IP (tos 0x10, ttl 64, id 21871, offset 0, flags [DF], proto TCP (6), length 60)
    10.0.10.230.37518 > 192.168.1.254.8443: Flags [S], cksum 0xd7ba (incorrect -> 0xe1c5), seq 3143892755, win 29200, options [mss 1460,sackOK,TS val 19836270 ecr 0,nop,wscale 7], length 0
11:37:50.337726 IP (tos 0x10, ttl 63, id 21871, offset 0, flags [DF], proto TCP (6), length 60)
    10.0.10.230.37518 > 10.0.10.230.8443: Flags [S], cksum 0x29fa (incorrect -> 0x8f86), seq 3143892755, win 29200, options [mss 1460,sackOK,TS val 19836270 ecr 0,nop,wscale 7], length 0

# lxc info
  driver: lxc
  driverversion: 2.0.7
  kernel: Linux
  kernelarchitecture: x86_64
  kernelversion: 4.4.0-64-generic
  server: lxd
  serverpid: 27801
  serverversion: 2.0.9
  storage: zfs
  storageversion: "5"

**Comment by stgraber** [comment]
That's not really a LXD specific problem, the same happens in any environment which uses NAT.
See: http://serverfault.com/questions/205040/accessing-the-dnatted-webserver-from-inside-the-lan

So you need to configure your firewall to do hairpin NAT for that IP so that the NAT rules you have for the outside also apply from the inside.

**Comment by gianpietro1** [comment]
@stgraber , I was convinced that that single PREROUTING rule was working for both internal and external hosts, my mistake.
Adding the POSTROUTING rule for internal hosts made the trick.
Thanks!!
