### ISSUE TITLE
LXD container cannot reach the outside, but LXC container can (arp related apparently)

### ISSUE THREAD

**Issue by jdavid** [lxc/lxd#2203]
# Required information

* Host: Gentoo latest
* Container: Ubuntu xenial (amd64) fingerprint 896d248dc141

lxc info:

    # lxc info
    apicompat: 0
    auth: trusted
    environment:
      addresses:
      - 163.172.33.176:8443ward Packets between interface
      - 10.91.150.8:8443
      architectures:
      - x86_64
      - i686
      certificate: |
        -----BEGIN CERTIFICATE-----
       [...]
        -----END CERTIFICATE-----
      certificatefingerprint: 796897b26915b21766817feb8264f87b5be99cf07e4574158e6c50dfc098cd92
      driver: lxcward Packets between interface
      driverversion: 2.0.3
      kernel: Linux
      kernelarchitecture: x86_64
      kernelversion: 4.6.3-gentoo
      server: lxd
      serverpid: 3606
      serverversion: 2.0.3
      storage: btrfs
      storageversion: 4.4.1
    config:ward Packets between interface
      core.https_address: 0.0.0.0:8443
      core.trust_password: true
    public: false

# Issue description

Container cannot reach the outside, tested both macvlan and bridge.
While it does work with LXC containers. With LXD ping from the
outside reaches the container, but the container cannot reply, because
arp does not reply to it.

With LXD tcpdumps output is:

17:14:08.974282 IP 79.108.175.160 > 62.210.9.50: ICMP echo request, id 9267, seq 1, length 64
17:14:08.974303 ARP, Request who-has 163.172.34.1 tell 62.210.9.50, length 28

While with LXC tcpdump shows:

17:15:37.897085 IP 79.108.175.160 > 62.210.9.50: ICMP echo request, id 9275, seq 1, length 64
17:15:37.897106 ARP, Request who-has 163.172.33.1 tell 62.210.9.50, length 28
17:15:37.897869 ARP, Reply 163.172.33.1 is-at 00:c8:8b:e2:6c:45, length 46

Tried privileged LXD with the same result.

# Information to attach

lxc config:

    # lxc config show francesc --expanded
    name: francesc
    profiles:
    - default
    config:
      volatile.base_image: 896d248dc141f517272353f026aa2fe6026f9f9a46776fbb1faf4723e5c92424
      volatile.eth0.name: eth0
      volatile.last_state.idmap: '[{"Isuid":true,"Isgid":false,"Hostid":1000000,"Nsid":0,"Maprange":100000},{"Isuid":false,"Isgid":true,"Hostid":1000000,"Nsid":0,"Maprange":100000}]'
    devices:
      eth0:
        hwaddr: 52:54:00:00:4c:18
        nictype: macvlan
        parent: enp1s0f0
        type: nic
      root:
        path: /
        type: disk
    ephemeral: false

lxc info francesc --show-log:

    Name: francesc
    Architecture: x86_64
    Created: 2016/07/13 12:54 UTC
    Status: Running
    Type: persistent
    Profiles: default
    Pid: 2911
    Ips:
      eth0:	inet	62.210.9.50
      eth0:	inet6	fe80::5054:ff:fe00:4c18
      lo:	inet	127.0.0.1
      lo:	inet6	::1
    Resources:
      Processes: 9
      Memory usage:
        Memory (current): 44.00MB
        Memory (peak): 46.64MB
      Network usage:
        lo:
          Bytes received: 11.13kB
          Bytes sent: 11.13kB
          Packets received: 123
          Packets sent: 123
        eth0:
          Bytes received: 716.10kB
          Bytes sent: 9.92kB
          Packets received: 8447
          Packets sent: 232
    
    Log:
    
                lxc 20160713175352.240 WARN     lxc_cgmanager - cgmanager.c:cgm_get:989 - do_cgm_get exited with error
                lxc 20160713175352.240 INFO     lxc_start - start.c:lxc_check_inherited:251 - closed inherited fd 3
                lxc 20160713175352.240 INFO     lxc_start - start.c:lxc_check_inherited:251 - closed inherited fd 8
                lxc 20160713175352.245 INFO     lxc_container - lxccontainer.c:do_lxcapi_start:797 - Attempting to set proc title to [lxc monitor] /var/lib/lxd/containers francesc
                lxc 20160713175352.246 INFO     lxc_start - start.c:lxc_check_inherited:251 - closed inherited fd 8
                lxc 20160713175352.246 INFO     lxc_seccomp - seccomp.c:parse_config_v2:342 - processing: .reject_force_umount  # comment this to allow umount -f;  not recommended.
                lxc 20160713175352.246 INFO     lxc_seccomp - seccomp.c:parse_config_v2:446 - Adding native rule for reject_force_umount action 0
                lxc 20160713175352.246 INFO     lxc_seccomp - seccomp.c:do_resolve_add_rule:216 - Setting seccomp rule to reject force umounts
    
                lxc 20160713175352.246 INFO     lxc_seccomp - seccomp.c:parse_config_v2:449 - Adding compat rule for reject_force_umount action 0
                lxc 20160713175352.246 INFO     lxc_seccomp - seccomp.c:do_resolve_add_rule:216 - Setting seccomp rule to reject force umounts
    
                lxc 20160713175352.246 INFO     lxc_seccomp - seccomp.c:parse_config_v2:342 - processing: .[all].
                lxc 20160713175352.246 INFO     lxc_seccomp - seccomp.c:parse_config_v2:342 - processing: .kexec_load errno 1.
                lxc 20160713175352.246 INFO     lxc_seccomp - seccomp.c:parse_config_v2:446 - Adding native rule for kexec_load action 327681
                lxc 20160713175352.246 INFO     lxc_seccomp - seccomp.c:parse_config_v2:449 - Adding compat rule for kexec_load action 327681
                lxc 20160713175352.246 INFO     lxc_seccomp - seccomp.c:parse_config_v2:342 - processing: .open_by_handle_at errno 1.
                lxc 20160713175352.246 INFO     lxc_seccomp - seccomp.c:parse_config_v2:446 - Adding native rule for open_by_handle_at action 327681
                lxc 20160713175352.246 INFO     lxc_seccomp - seccomp.c:parse_config_v2:449 - Adding compat rule for open_by_handle_at action 327681
                lxc 20160713175352.246 INFO     lxc_seccomp - seccomp.c:parse_config_v2:342 - processing: .init_module errno 1.
                lxc 20160713175352.246 INFO     lxc_seccomp - seccomp.c:parse_config_v2:446 - Adding native rule for init_module action 327681
                lxc 20160713175352.246 INFO     lxc_seccomp - seccomp.c:parse_config_v2:449 - Adding compat rule for init_module action 327681
                lxc 20160713175352.246 INFO     lxc_seccomp - seccomp.c:parse_config_v2:342 - processing: .finit_module errno 1.
                lxc 20160713175352.246 INFO     lxc_seccomp - seccomp.c:parse_config_v2:446 - Adding native rule for finit_module action 327681
                lxc 20160713175352.246 INFO     lxc_seccomp - seccomp.c:parse_config_v2:449 - Adding compat rule for finit_module action 327681
                lxc 20160713175352.246 INFO     lxc_seccomp - seccomp.c:parse_config_v2:342 - processing: .delete_module errno 1.
                lxc 20160713175352.246 INFO     lxc_seccomp - seccomp.c:parse_config_v2:446 - Adding native rule for delete_module action 327681
                lxc 20160713175352.246 INFO     lxc_seccomp - seccomp.c:parse_config_v2:449 - Adding compat rule for delete_module action 327681
                lxc 20160713175352.246 INFO     lxc_seccomp - seccomp.c:parse_config_v2:456 - Merging in the compat seccomp ctx into the main one
                lxc 20160713175352.246 INFO     lxc_conf - conf.c:run_script_argv:367 - Executing script '/usr/sbin/lxd callhook /var/lib/lxd 18 start' for container 'francesc', config section 'lxc'
                lxc 20160713175352.246 INFO     lxc_start - start.c:lxc_check_inherited:251 - closed inherited fd 3
                lxc 20160713175352.246 INFO     lxc_start - start.c:lxc_check_inherited:251 - closed inherited fd 8
                lxc 20160713175352.252 INFO     lxc_monitor - monitor.c:lxc_monitor_sock_name:178 - using monitor sock name lxc/d78a9d7e97b4b375//var/lib/lxd/containers
                lxc 20160713175352.259 DEBUG    lxc_start - start.c:setup_signal_fd:289 - sigchild handler set
                lxc 20160713175352.259 INFO     lxc_confile - confile.c:config_idmap:1500 - read uid map: type u nsid 0 hostid 1000000 range 100000
                lxc 20160713175352.259 INFO     lxc_confile - confile.c:config_idmap:1500 - read uid map: type g nsid 0 hostid 1000000 range 100000
                lxc 20160713175352.259 DEBUG    lxc_console - console.c:lxc_console_peer_default:469 - no console peer
                lxc 20160713175352.259 INFO     lxc_start - start.c:lxc_init:488 - 'francesc' is initialized
                lxc 20160713175352.259 DEBUG    lxc_start - start.c:__lxc_start:1326 - Not dropping cap_sys_boot or watching utmp
                lxc 20160713175352.259 INFO     lxc_start - start.c:resolve_clone_flags:1013 - Cloning a new user namespace
                lxc 20160713175352.265 DEBUG    lxc_conf - conf.c:instantiate_macvlan:2687 - instantiated macvlan 'mc5JXBAX', index is '4' and mode '4'
                lxc 20160713175352.265 INFO     lxc_cgroup - cgroup.c:cgroup_init:68 - cgroup driver cgmanager initing for francesc
                lxc 20160713175352.297 DEBUG    lxc_conf - conf.c:lxc_assign_network:3048 - move 'eth0' to '2911'
                lxc 20160713175352.297 NOTICE   lxc_start - start.c:do_start:777 - switching to gid/uid 0/0 in new user namespace
                lxc 20160713175352.297 DEBUG    lxc_conf - conf.c:setup_rootfs:1215 - mounted '/var/lib/lxd/containers/francesc/rootfs' on '/var/lib/lxc/rootfs'
                lxc 20160713175352.297 INFO     lxc_conf - conf.c:setup_utsname:843 - 'francesc' hostname has been setup
                lxc 20160713175352.308 DEBUG    lxc_conf - conf.c:setup_hw_addr:2145 - mac address '52:54:00:00:4c:18' on 'eth0' has been setup
                lxc 20160713175352.309 DEBUG    lxc_conf - conf.c:setup_netdev:2372 - 'eth0' has been setup
                lxc 20160713175352.309 INFO     lxc_conf - conf.c:setup_network:2393 - network has been setup
                lxc 20160713175352.309 INFO     lxc_conf - conf.c:mount_autodev:1072 - Mounting container /dev
                lxc 20160713175352.310 INFO     lxc_conf - conf.c:mount_autodev:1095 - Mounted tmpfs onto /var/lib/lxc/rootfs/dev
                lxc 20160713175352.310 INFO     lxc_conf - conf.c:mount_autodev:1113 - Mounted container /dev
                lxc 20160713175352.311 DEBUG    lxc_conf - conf.c:mount_entry:1657 - remounting /dev/fuse on /var/lib/lxc/rootfs/dev/fuse to respect bind or remount options
                lxc 20160713175352.311 DEBUG    lxc_conf - conf.c:mount_entry:1672 - (at remount) flags for /dev/fuse was 4098, required extra flags are 2
                lxc 20160713175352.311 DEBUG    lxc_conf - conf.c:mount_entry:1707 - mounted '/dev/fuse' on '/var/lib/lxc/rootfs/dev/fuse', type 'none'
                lxc 20160713175352.340 DEBUG    lxc_conf - conf.c:mount_entry:1657 - remounting /proc/sys/fs/binfmt_misc on /var/lib/lxc/rootfs/proc/sys/fs/binfmt_misc to respect bind or remount options
                lxc 20160713175352.340 DEBUG    lxc_conf - conf.c:mount_entry:1672 - (at remount) flags for /proc/sys/fs/binfmt_misc was 4096, required extra flags are 0
                lxc 20160713175352.340 DEBUG    lxc_conf - conf.c:mount_entry:1681 - mountflags already was 20480, skipping remount
                lxc 20160713175352.340 DEBUG    lxc_conf - conf.c:mount_entry:1707 - mounted '/proc/sys/fs/binfmt_misc' on '/var/lib/lxc/rootfs/proc/sys/fs/binfmt_misc', type 'none'
                lxc 20160713175352.340 DEBUG    lxc_conf - conf.c:mount_entry:1657 - remounting /sys/fs/fuse/connections on /var/lib/lxc/rootfs/sys/fs/fuse/connections to respect bind or remount options
                lxc 20160713175352.340 DEBUG    lxc_conf - conf.c:mount_entry:1672 - (at remount) flags for /sys/fs/fuse/connections was 4096, required extra flags are 0
                lxc 20160713175352.340 DEBUG    lxc_conf - conf.c:mount_entry:1681 - mountflags already was 20480, skipping remount
                lxc 20160713175352.340 DEBUG    lxc_conf - conf.c:mount_entry:1707 - mounted '/sys/fs/fuse/connections' on '/var/lib/lxc/rootfs/sys/fs/fuse/connections', type 'none'
                lxc 20160713175352.340 DEBUG    lxc_conf - conf.c:mount_entry:1657 - remounting /sys/fs/pstore on /var/lib/lxc/rootfs/sys/fs/pstore to respect bind or remount options
                lxc 20160713175352.340 DEBUG    lxc_conf - conf.c:mount_entry:1672 - (at remount) flags for /sys/fs/pstore was 4110, required extra flags are 14
                lxc 20160713175352.340 DEBUG    lxc_conf - conf.c:mount_entry:1707 - mounted '/sys/fs/pstore' on '/var/lib/lxc/rootfs/sys/fs/pstore', type 'none'
                lxc 20160713175352.340 DEBUG    lxc_conf - conf.c:mount_entry:1657 - remounting /sys/kernel/debug on /var/lib/lxc/rootfs/sys/kernel/debug to respect bind or remount options
                lxc 20160713175352.340 DEBUG    lxc_conf - conf.c:mount_entry:1672 - (at remount) flags for /sys/kernel/debug was 4096, required extra flags are 0
                lxc 20160713175352.340 DEBUG    lxc_conf - conf.c:mount_entry:1681 - mountflags already was 20480, skipping remount
                lxc 20160713175352.340 DEBUG    lxc_conf - conf.c:mount_entry:1707 - mounted '/sys/kernel/debug' on '/var/lib/lxc/rootfs/sys/kernel/debug', type 'none'
                lxc 20160713175352.340 DEBUG    lxc_conf - conf.c:mount_entry:1657 - remounting /sys/kernel/security on /var/lib/lxc/rootfs/sys/kernel/security to respect bind or remount options
                lxc 20160713175352.340 DEBUG    lxc_conf - conf.c:mount_entry:1672 - (at remount) flags for /sys/kernel/security was 4110, required extra flags are 14
                lxc 20160713175352.340 DEBUG    lxc_conf - conf.c:mount_entry:1707 - mounted '/sys/kernel/security' on '/var/lib/lxc/rootfs/sys/kernel/security', type 'none'
                lxc 20160713175352.340 DEBUG    lxc_conf - conf.c:mount_entry:1657 - remounting /dev/mqueue on /var/lib/lxc/rootfs/dev/mqueue to respect bind or remount options
                lxc 20160713175352.340 DEBUG    lxc_conf - conf.c:mount_entry:1672 - (at remount) flags for /dev/mqueue was 4096, required extra flags are 0
                lxc 20160713175352.340 DEBUG    lxc_conf - conf.c:mount_entry:1681 - mountflags already was 20480, skipping remount
                lxc 20160713175352.340 DEBUG    lxc_conf - conf.c:mount_entry:1707 - mounted '/dev/mqueue' on '/var/lib/lxc/rootfs/dev/mqueue', type 'none'
                lxc 20160713175352.340 DEBUG    lxc_conf - conf.c:mount_entry:1657 - remounting /var/lib/lxd/devlxd on /var/lib/lxc/rootfs/dev/lxd to respect bind or remount options
                lxc 20160713175352.340 DEBUG    lxc_conf - conf.c:mount_entry:1672 - (at remount) flags for /var/lib/lxd/devlxd was 1024, required extra flags are 0
                lxc 20160713175352.340 DEBUG    lxc_conf - conf.c:mount_entry:1681 - mountflags already was 4096, skipping remount
                lxc 20160713175352.340 DEBUG    lxc_conf - conf.c:mount_entry:1707 - mounted '/var/lib/lxd/devlxd' on '/var/lib/lxc/rootfs/dev/lxd', type 'none'
                lxc 20160713175352.340 DEBUG    lxc_conf - conf.c:mount_entry:1657 - remounting /var/lib/lxd/shmounts/francesc on /var/lib/lxc/rootfs/dev/.lxd-mounts to respect bind or remount options
                lxc 20160713175352.340 DEBUG    lxc_conf - conf.c:mount_entry:1672 - (at remount) flags for /var/lib/lxd/shmounts/francesc was 1024, required extra flags are 0
                lxc 20160713175352.340 DEBUG    lxc_conf - conf.c:mount_entry:1681 - mountflags already was 4096, skipping remount
                lxc 20160713175352.340 DEBUG    lxc_conf - conf.c:mount_entry:1707 - mounted '/var/lib/lxd/shmounts/francesc' on '/var/lib/lxc/rootfs/dev/.lxd-mounts', type 'none'
                lxc 20160713175352.340 INFO     lxc_conf - conf.c:mount_file_entries:1926 - mount points have been setup
                lxc 20160713175352.340 INFO     lxc_conf - conf.c:run_script_argv:367 - Executing script '/usr/share/lxcfs/lxc.mount.hook' for container 'francesc', config section 'lxc'
                lxc 20160713175352.355 INFO     lxc_conf - conf.c:fill_autodev:1141 - Creating initial consoles under container /dev
                lxc 20160713175352.355 INFO     lxc_conf - conf.c:fill_autodev:1152 - Populating container /dev
                lxc 20160713175352.355 INFO     lxc_conf - conf.c:fill_autodev:1189 - Populated container /dev
                lxc 20160713175352.355 INFO     lxc_conf - conf.c:setup_dev_console:1437 - console has been setup
                lxc 20160713175352.355 INFO     lxc_utils - utils.c:mount_proc_if_needed:1726 - I am 1, /proc/self points to '1'
                lxc 20160713155352.368 DEBUG    lxc_conf - conf.c:setup_rootfs_pivot_root:1050 - pivot_root syscall to '/var/lib/lxc/rootfs' successful
                lxc 20160713155352.371 INFO     lxc_conf - conf.c:setup_tty:995 - 0 tty(s) has been setup
                lxc 20160713155352.371 INFO     lxc_conf - conf.c:setup_personality:1393 - set personality to '0x0'
                lxc 20160713155352.371 DEBUG    lxc_conf - conf.c:setup_caps:2056 - drop capability 'mac_admin' (33)
                lxc 20160713155352.371 DEBUG    lxc_conf - conf.c:setup_caps:2056 - drop capability 'mac_override' (32)
                lxc 20160713155352.371 DEBUG    lxc_conf - conf.c:setup_caps:2056 - drop capability 'sys_time' (25)
                lxc 20160713155352.371 DEBUG    lxc_conf - conf.c:setup_caps:2056 - drop capability 'sys_module' (16)
                lxc 20160713155352.371 DEBUG    lxc_conf - conf.c:setup_caps:2056 - drop capability 'sys_rawio' (17)
                lxc 20160713155352.371 DEBUG    lxc_conf - conf.c:setup_caps:2065 - capabilities have been setup
                lxc 20160713155352.371 NOTICE   lxc_conf - conf.c:lxc_setup:3839 - 'francesc' is setup.
                lxc 20160713155352.371 NOTICE   lxc_start - start.c:start:1435 - exec'ing '/sbin/init'
                lxc 20160713175352.375 NOTICE   lxc_start - start.c:post_start:1446 - '/sbin/init' started with pid '2911'
                lxc 20160713175352.375 WARN     lxc_start - start.c:signal_handler:337 - invalid pid for SIGCHLD
                lxc 20160713175352.375 DEBUG    lxc_commands - commands.c:lxc_cmd_handler:893 - peer has disconnected
                lxc 20160713175352.375 DEBUG    lxc_commands - commands.c:lxc_cmd_handler:893 - peer has disconnected
                lxc 20160713175352.385 DEBUG    lxc_commands - commands.c:lxc_cmd_get_state:579 - 'francesc' is in 'RUNNING' state
                lxc 20160713175352.385 DEBUG    lxc_commands - commands.c:lxc_cmd_handler:893 - peer has disconnected
                lxc 20160713175352.385 DEBUG    lxc_commands - commands.c:lxc_cmd_handler:893 - peer has disconnected
                lxc 20160713175352.385 DEBUG    lxc_commands - commands.c:lxc_cmd_get_state:579 - 'francesc' is in 'RUNNING' state
                lxc 20160713175352.386 DEBUG    lxc_commands - commands.c:lxc_cmd_handler:893 - peer has disconnected
                lxc 20160713175352.387 DEBUG    lxc_commands - commands.c:lxc_cmd_handler:893 - peer has disconnected
                lxc 20160713175352.387 DEBUG    lxc_commands - commands.c:lxc_cmd_get_state:579 - 'francesc' is in 'RUNNING' state
                lxc 20160713175352.388 DEBUG    lxc_commands - commands.c:lxc_cmd_handler:893 - peer has disconnected
                lxc 20160713175352.389 DEBUG    lxc_commands - commands.c:lxc_cmd_get_state:579 - 'francesc' is in 'RUNNING' state
                lxc 20160713175352.389 DEBUG    lxc_commands - commands.c:lxc_cmd_handler:893 - peer has disconnected
                lxc 20160713175352.390 DEBUG    lxc_commands - commands.c:lxc_cmd_handler:893 - peer has disconnected
                lxc 20160713175352.390 DEBUG    lxc_commands - commands.c:lxc_cmd_handler:893 - peer has disconnected
                lxc 20160713175352.390 DEBUG    lxc_commands - commands.c:lxc_cmd_get_state:579 - 'francesc' is in 'RUNNING' state
                lxc 20160713175352.391 DEBUG    lxc_commands - commands.c:lxc_cmd_handler:893 - peer has disconnected
                lxc 20160713180056.035 INFO     lxc_confile - confile.c:config_idmap:1500 - read uid map: type u nsid 0 hostid 1000000 range 100000
                lxc 20160713180056.035 INFO     lxc_confile - confile.c:config_idmap:1500 - read uid map: type g nsid 0 hostid 1000000 range 100000
                lxc 20160713180056.036 DEBUG    lxc_commands - commands.c:lxc_cmd_handler:893 - peer has disconnected
                lxc 20160713180056.049 DEBUG    lxc_commands - commands.c:lxc_cmd_get_state:579 - 'francesc' is in 'RUNNING' state
                lxc 20160713180056.049 DEBUG    lxc_commands - commands.c:lxc_cmd_handler:893 - peer has disconnected
                lxc 20160713180056.050 DEBUG    lxc_commands - commands.c:lxc_cmd_handler:893 - peer has disconnected
                lxc 20160713180056.051 DEBUG    lxc_commands - commands.c:lxc_cmd_handler:893 - peer has disconnected
                lxc 20160713180056.051 DEBUG    lxc_commands - commands.c:lxc_cmd_get_state:579 - 'francesc' is in 'RUNNING' state
                lxc 20160713180056.085 DEBUG    lxc_commands - commands.c:lxc_cmd_handler:893 - peer has disconnected
                lxc 20160713180056.086 DEBUG    lxc_commands - commands.c:lxc_cmd_handler:893 - peer has disconnected
                lxc 20160713180056.086 DEBUG    lxc_commands - commands.c:lxc_cmd_get_state:579 - 'francesc' is in 'RUNNING' state
                lxc 20160713180056.086 DEBUG    lxc_commands - commands.c:lxc_cmd_handler:893 - peer has disconnected
                lxc 20160713180056.086 DEBUG    lxc_commands - commands.c:lxc_cmd_handler:893 - peer has disconnected
                lxc 20160713180056.086 DEBUG    lxc_commands - commands.c:lxc_cmd_handler:893 - peer has disconnected
                lxc 20160713180056.086 INFO     lxc_seccomp - seccomp.c:parse_config_v2:342 - processing: .reject_force_umount  # comment this to allow umount -f;  not recommended.
                lxc 20160713180056.086 INFO     lxc_seccomp - seccomp.c:parse_config_v2:446 - Adding native rule for reject_force_umount action 0
                lxc 20160713180056.086 INFO     lxc_seccomp - seccomp.c:do_resolve_add_rule:216 - Setting seccomp rule to reject force umounts
    
                lxc 20160713180056.086 INFO     lxc_seccomp - seccomp.c:parse_config_v2:449 - Adding compat rule for reject_force_umount action 0
                lxc 20160713180056.086 INFO     lxc_seccomp - seccomp.c:do_resolve_add_rule:216 - Setting seccomp rule to reject force umounts
    
                lxc 20160713180056.086 INFO     lxc_seccomp - seccomp.c:parse_config_v2:342 - processing: .[all].
                lxc 20160713180056.086 INFO     lxc_seccomp - seccomp.c:parse_config_v2:342 - processing: .kexec_load errno 1.
                lxc 20160713180056.086 INFO     lxc_seccomp - seccomp.c:parse_config_v2:446 - Adding native rule for kexec_load action 327681
                lxc 20160713180056.086 INFO     lxc_seccomp - seccomp.c:parse_config_v2:449 - Adding compat rule for kexec_load action 327681
                lxc 20160713180056.086 INFO     lxc_seccomp - seccomp.c:parse_config_v2:342 - processing: .open_by_handle_at errno 1.
                lxc 20160713180056.086 INFO     lxc_seccomp - seccomp.c:parse_config_v2:446 - Adding native rule for open_by_handle_at action 327681
                lxc 20160713180056.086 INFO     lxc_seccomp - seccomp.c:parse_config_v2:449 - Adding compat rule for open_by_handle_at action 327681
                lxc 20160713180056.086 INFO     lxc_seccomp - seccomp.c:parse_config_v2:342 - processing: .init_module errno 1.
                lxc 20160713180056.086 INFO     lxc_seccomp - seccomp.c:parse_config_v2:446 - Adding native rule for init_module action 327681
                lxc 20160713180056.086 INFO     lxc_seccomp - seccomp.c:parse_config_v2:449 - Adding compat rule for init_module action 327681
                lxc 20160713180056.086 INFO     lxc_seccomp - seccomp.c:parse_config_v2:342 - processing: .finit_module errno 1.
                lxc 20160713180056.086 INFO     lxc_seccomp - seccomp.c:parse_config_v2:446 - Adding native rule for finit_module action 327681
                lxc 20160713180056.086 INFO     lxc_seccomp - seccomp.c:parse_config_v2:449 - Adding compat rule for finit_module action 327681
                lxc 20160713180056.086 INFO     lxc_seccomp - seccomp.c:parse_config_v2:342 - processing: .delete_module errno 1.
                lxc 20160713180056.086 INFO     lxc_seccomp - seccomp.c:parse_config_v2:446 - Adding native rule for delete_module action 327681
                lxc 20160713180056.086 INFO     lxc_seccomp - seccomp.c:parse_config_v2:449 - Adding compat rule for delete_module action 327681
                lxc 20160713180056.086 INFO     lxc_seccomp - seccomp.c:parse_config_v2:456 - Merging in the compat seccomp ctx into the main one
                lxc 20160713180056.086 DEBUG    lxc_commands - commands.c:lxc_cmd_handler:893 - peer has disconnected
                lxc 20160713180056.086 DEBUG    lxc_commands - commands.c:lxc_cmd_handler:893 - peer has disconnected
                lxc 20160713180056.087 DEBUG    lxc_commands - commands.c:lxc_cmd_handler:893 - peer has disconnected
                lxc 20160713180056.087 DEBUG    lxc_commands - commands.c:lxc_cmd_handler:893 - peer has disconnected
                lxc 20160713180056.087 DEBUG    lxc_commands - commands.c:lxc_cmd_handler:893 - peer has disconnected
                lxc 20160713180056.087 DEBUG    lxc_commands - commands.c:lxc_cmd_handler:893 - peer has disconnected
                lxc 20160713180056.087 DEBUG    lxc_commands - commands.c:lxc_cmd_handler:893 - peer has disconnected
                lxc 20160713180056.088 DEBUG    lxc_commands - commands.c:lxc_cmd_handler:893 - peer has disconnected
                lxc 20160713180056.088 DEBUG    lxc_commands - commands.c:lxc_cmd_handler:893 - peer has disconnected
                lxc 20160713180056.088 DEBUG    lxc_commands - commands.c:lxc_cmd_handler:893 - peer has disconnected
                lxc 20160713180056.088 DEBUG    lxc_commands - commands.c:lxc_cmd_handler:893 - peer has disconnected
                lxc 20160713180056.089 DEBUG    lxc_commands - commands.c:lxc_cmd_handler:893 - peer has disconnected
                lxc 20160713160056.089 INFO     lxc_attach - attach.c:lxc_attach:969 - Unshared cgroup namespace
                lxc 20160713181827.819 INFO     lxc_confile - confile.c:config_idmap:1500 - read uid map: type u nsid 0 hostid 1000000 range 100000
                lxc 20160713181827.819 INFO     lxc_confile - confile.c:config_idmap:1500 - read uid map: type g nsid 0 hostid 1000000 range 100000
                lxc 20160713181827.821 DEBUG    lxc_commands - commands.c:lxc_cmd_handler:893 - peer has disconnected
                lxc 20160713181827.837 DEBUG    lxc_commands - commands.c:lxc_cmd_handler:893 - peer has disconnected
                lxc 20160713181827.837 DEBUG    lxc_commands - commands.c:lxc_cmd_get_state:579 - 'francesc' is in 'RUNNING' state
                lxc 20160713181827.840 INFO     lxc_confile - confile.c:config_idmap:1500 - read uid map: type u nsid 0 hostid 1000000 range 100000
                lxc 20160713181827.841 INFO     lxc_confile - confile.c:config_idmap:1500 - read uid map: type g nsid 0 hostid 1000000 range 100000
                lxc 20160713181827.842 DEBUG    lxc_commands - commands.c:lxc_cmd_handler:893 - peer has disconnected
                lxc 20160713181827.843 DEBUG    lxc_commands - commands.c:lxc_cmd_handler:893 - peer has disconnected
                lxc 20160713181827.843 DEBUG    lxc_commands - commands.c:lxc_cmd_get_state:579 - 'francesc' is in 'RUNNING' state
                lxc 20160713181827.844 DEBUG    lxc_commands - commands.c:lxc_cmd_handler:893 - peer has disconnected
                lxc 20160713181827.845 DEBUG    lxc_commands - commands.c:lxc_cmd_handler:893 - peer has disconnected
                lxc 20160713181827.845 DEBUG    lxc_commands - commands.c:lxc_cmd_get_state:579 - 'francesc' is in 'RUNNING' state
                lxc 20160713181827.845 DEBUG    lxc_commands - commands.c:lxc_cmd_handler:893 - peer has disconnected
                lxc 20160713181827.846 DEBUG    lxc_commands - commands.c:lxc_cmd_handler:893 - peer has disconnected
                lxc 20160713181827.847 DEBUG    lxc_commands - commands.c:lxc_cmd_handler:893 - peer has disconnected
                lxc 20160713181827.847 DEBUG    lxc_commands - commands.c:lxc_cmd_get_state:579 - 'francesc' is in 'RUNNING' state
                lxc 20160713181827.847 DEBUG    lxc_commands - commands.c:lxc_cmd_handler:893 - peer has disconnected
                lxc 20160713181827.848 DEBUG    lxc_commands - commands.c:lxc_cmd_handler:893 - peer has disconnected
                lxc 20160713181827.848 DEBUG    lxc_commands - commands.c:lxc_cmd_get_state:579 - 'francesc' is in 'RUNNING' state
                lxc 20160713181827.849 DEBUG    lxc_commands - commands.c:lxc_cmd_handler:893 - peer has disconnected
                lxc 20160713181827.850 DEBUG    lxc_commands - commands.c:lxc_cmd_handler:893 - peer has disconnected
                lxc 20160713181827.850 DEBUG    lxc_commands - commands.c:lxc_cmd_handler:893 - peer has disconnected
                lxc 20160713181827.850 DEBUG    lxc_commands - commands.c:lxc_cmd_get_state:579 - 'francesc' is in 'RUNNING' state
                lxc 20160713181827.851 DEBUG    lxc_commands - commands.c:lxc_cmd_handler:893 - peer has disconnected
                lxc 20160713181827.852 DEBUG    lxc_commands - commands.c:lxc_cmd_handler:893 - peer has disconnected
                lxc 20160713181827.852 DEBUG    lxc_commands - commands.c:lxc_cmd_handler:893 - peer has disconnected
                lxc 20160713181827.852 DEBUG    lxc_commands - commands.c:lxc_cmd_get_state:579 - 'francesc' is in 'RUNNING' state
                lxc 20160713181827.853 DEBUG    lxc_commands - commands.c:lxc_cmd_handler:893 - peer has disconnected
                lxc 20160713181827.853 DEBUG    lxc_commands - commands.c:lxc_cmd_handler:893 - peer has disconnected
                lxc 20160713181827.853 DEBUG    lxc_commands - commands.c:lxc_cmd_get_state:579 - 'francesc' is in 'RUNNING' state
                lxc 20160713181827.854 DEBUG    lxc_commands - commands.c:lxc_cmd_handler:893 - peer has disconnected
                lxc 20160713181827.855 DEBUG    lxc_commands - commands.c:lxc_cmd_handler:893 - peer has disconnected
                lxc 20160713181827.855 DEBUG    lxc_commands - commands.c:lxc_cmd_handler:893 - peer has disconnected
                lxc 20160713181827.855 DEBUG    lxc_commands - commands.c:lxc_cmd_get_state:579 - 'francesc' is in 'RUNNING' state
                lxc 20160713181827.856 DEBUG    lxc_commands - commands.c:lxc_cmd_handler:893 - peer has disconnected
                lxc 20160713181827.856 DEBUG    lxc_commands - commands.c:lxc_cmd_handler:893 - peer has disconnected
                lxc 20160713181827.863 DEBUG    lxc_commands - commands.c:lxc_cmd_handler:893 - peer has disconnected
                lxc 20160713181827.864 DEBUG    lxc_commands - commands.c:lxc_cmd_handler:893 - peer has disconnected
                lxc 20160713181827.864 DEBUG    lxc_commands - commands.c:lxc_cmd_get_state:579 - 'francesc' is in 'RUNNING' state
                lxc 20160713181827.864 DEBUG    lxc_commands - commands.c:lxc_cmd_handler:893 - peer has disconnected
                lxc 20160713181827.864 DEBUG    lxc_commands - commands.c:lxc_cmd_handler:893 - peer has disconnected
                lxc 20160713181827.864 DEBUG    lxc_commands - commands.c:lxc_cmd_handler:893 - peer has disconnected
                lxc 20160713181827.865 DEBUG    lxc_commands - commands.c:lxc_cmd_handler:893 - peer has disconnected
                lxc 20160713181827.865 DEBUG    lxc_commands - commands.c:lxc_cmd_get_state:579 - 'francesc' is in 'RUNNING' state
                lxc 20160713181827.865 DEBUG    lxc_commands - commands.c:lxc_cmd_handler:893 - peer has disconnected
                lxc 20160713181827.865 DEBUG    lxc_commands - commands.c:lxc_cmd_handler:893 - peer has disconnected
                lxc 20160713181827.866 DEBUG    lxc_commands - commands.c:lxc_cmd_handler:893 - peer has disconnected
                lxc 20160713181827.866 DEBUG    lxc_commands - commands.c:lxc_cmd_handler:893 - peer has disconnected
                lxc 20160713181827.866 DEBUG    lxc_commands - commands.c:lxc_cmd_get_state:579 - 'francesc' is in 'RUNNING' state
                lxc 20160713181827.867 DEBUG    lxc_commands - commands.c:lxc_cmd_handler:893 - peer has disconnected
                lxc 20160713181827.867 DEBUG    lxc_commands - commands.c:lxc_cmd_handler:893 - peer has disconnected
                lxc 20160713181827.867 DEBUG    lxc_commands - commands.c:lxc_cmd_get_state:579 - 'francesc' is in 'RUNNING' state
                lxc 20160713181827.868 DEBUG    lxc_commands - commands.c:lxc_cmd_handler:893 - peer has disconnected
                lxc 20160713181827.869 DEBUG    lxc_commands - commands.c:lxc_cmd_handler:893 - peer has disconnected
                lxc 20160713181827.870 DEBUG    lxc_commands - commands.c:lxc_cmd_handler:893 - peer has disconnected
                lxc 20160713181827.870 DEBUG    lxc_commands - commands.c:lxc_cmd_get_state:579 - 'francesc' is in 'RUNNING' state
                lxc 20160713181827.870 DEBUG    lxc_commands - commands.c:lxc_cmd_handler:893 - peer has disconnected
                lxc 20160713181847.211 INFO     lxc_confile - confile.c:config_idmap:1500 - read uid map: type u nsid 0 hostid 1000000 range 100000
                lxc 20160713181847.211 INFO     lxc_confile - confile.c:config_idmap:1500 - read uid map: type g nsid 0 hostid 1000000 range 100000
                lxc 20160713181847.213 DEBUG    lxc_commands - commands.c:lxc_cmd_handler:893 - peer has disconnected
                lxc 20160713181847.225 DEBUG    lxc_commands - commands.c:lxc_cmd_get_state:579 - 'francesc' is in 'RUNNING' state
                lxc 20160713181847.225 DEBUG    lxc_commands - commands.c:lxc_cmd_handler:893 - peer has disconnected
                lxc 20160713181847.226 DEBUG    lxc_commands - commands.c:lxc_cmd_handler:893 - peer has disconnected
                lxc 20160713181847.227 DEBUG    lxc_commands - commands.c:lxc_cmd_get_state:579 - 'francesc' is in 'RUNNING' state
                lxc 20160713181847.227 DEBUG    lxc_commands - commands.c:lxc_cmd_handler:893 - peer has disconnected
                lxc 20160713181847.253 DEBUG    lxc_commands - commands.c:lxc_cmd_handler:893 - peer has disconnected
                lxc 20160713181847.254 DEBUG    lxc_commands - commands.c:lxc_cmd_handler:893 - peer has disconnected
                lxc 20160713181847.254 DEBUG    lxc_commands - commands.c:lxc_cmd_get_state:579 - 'francesc' is in 'RUNNING' state
                lxc 20160713181847.254 DEBUG    lxc_commands - commands.c:lxc_cmd_handler:893 - peer has disconnected
                lxc 20160713181847.254 DEBUG    lxc_commands - commands.c:lxc_cmd_handler:893 - peer has disconnected
                lxc 20160713181847.254 DEBUG    lxc_commands - commands.c:lxc_cmd_handler:893 - peer has disconnected
                lxc 20160713181847.254 INFO     lxc_seccomp - seccomp.c:parse_config_v2:342 - processing: .reject_force_umount  # comment this to allow umount -f;  not recommended.
                lxc 20160713181847.254 INFO     lxc_seccomp - seccomp.c:parse_config_v2:446 - Adding native rule for reject_force_umount action 0
                lxc 20160713181847.254 INFO     lxc_seccomp - seccomp.c:do_resolve_add_rule:216 - Setting seccomp rule to reject force umounts
    
                lxc 20160713181847.254 INFO     lxc_seccomp - seccomp.c:parse_config_v2:449 - Adding compat rule for reject_force_umount action 0
                lxc 20160713181847.254 INFO     lxc_seccomp - seccomp.c:do_resolve_add_rule:216 - Setting seccomp rule to reject force umounts
    
                lxc 20160713181847.254 INFO     lxc_seccomp - seccomp.c:parse_config_v2:342 - processing: .[all].
                lxc 20160713181847.254 INFO     lxc_seccomp - seccomp.c:parse_config_v2:342 - processing: .kexec_load errno 1.
                lxc 20160713181847.254 INFO     lxc_seccomp - seccomp.c:parse_config_v2:446 - Adding native rule for kexec_load action 327681
                lxc 20160713181847.254 INFO     lxc_seccomp - seccomp.c:parse_config_v2:449 - Adding compat rule for kexec_load action 327681
                lxc 20160713181847.254 INFO     lxc_seccomp - seccomp.c:parse_config_v2:342 - processing: .open_by_handle_at errno 1.
                lxc 20160713181847.254 INFO     lxc_seccomp - seccomp.c:parse_config_v2:446 - Adding native rule for open_by_handle_at action 327681
                lxc 20160713181847.254 INFO     lxc_seccomp - seccomp.c:parse_config_v2:449 - Adding compat rule for open_by_handle_at action 327681
                lxc 20160713181847.254 INFO     lxc_seccomp - seccomp.c:parse_config_v2:342 - processing: .init_module errno 1.
                lxc 20160713181847.254 INFO     lxc_seccomp - seccomp.c:parse_config_v2:446 - Adding native rule for init_module action 327681
                lxc 20160713181847.254 INFO     lxc_seccomp - seccomp.c:parse_config_v2:449 - Adding compat rule for init_module action 327681
                lxc 20160713181847.254 INFO     lxc_seccomp - seccomp.c:parse_config_v2:342 - processing: .finit_module errno 1.
                lxc 20160713181847.254 INFO     lxc_seccomp - seccomp.c:parse_config_v2:446 - Adding native rule for finit_module action 327681
                lxc 20160713181847.254 INFO     lxc_seccomp - seccomp.c:parse_config_v2:449 - Adding compat rule for finit_module action 327681
                lxc 20160713181847.254 INFO     lxc_seccomp - seccomp.c:parse_config_v2:342 - processing: .delete_module errno 1.
                lxc 20160713181847.254 INFO     lxc_seccomp - seccomp.c:parse_config_v2:446 - Adding native rule for delete_module action 327681
                lxc 20160713181847.254 INFO     lxc_seccomp - seccomp.c:parse_config_v2:449 - Adding compat rule for delete_module action 327681
                lxc 20160713181847.254 INFO     lxc_seccomp - seccomp.c:parse_config_v2:456 - Merging in the compat seccomp ctx into the main one
                lxc 20160713181847.254 DEBUG    lxc_commands - commands.c:lxc_cmd_handler:893 - peer has disconnected
                lxc 20160713181847.255 DEBUG    lxc_commands - commands.c:lxc_cmd_handler:893 - peer has disconnected
                lxc 20160713181847.255 DEBUG    lxc_commands - commands.c:lxc_cmd_handler:893 - peer has disconnected
                lxc 20160713181847.255 DEBUG    lxc_commands - commands.c:lxc_cmd_handler:893 - peer has disconnected
                lxc 20160713181847.255 DEBUG    lxc_commands - commands.c:lxc_cmd_handler:893 - peer has disconnected
                lxc 20160713181847.256 DEBUG    lxc_commands - commands.c:lxc_cmd_handler:893 - peer has disconnected
                lxc 20160713181847.256 DEBUG    lxc_commands - commands.c:lxc_cmd_handler:893 - peer has disconnected
                lxc 20160713181847.256 DEBUG    lxc_commands - commands.c:lxc_cmd_handler:893 - peer has disconnected
                lxc 20160713181847.256 DEBUG    lxc_commands - commands.c:lxc_cmd_handler:893 - peer has disconnected
                lxc 20160713181847.257 DEBUG    lxc_commands - commands.c:lxc_cmd_handler:893 - peer has disconnected
                lxc 20160713181847.257 DEBUG    lxc_commands - commands.c:lxc_cmd_handler:893 - peer has disconnected
                lxc 20160713181847.257 DEBUG    lxc_commands - commands.c:lxc_cmd_handler:893 - peer has disconnected
                lxc 20160713161847.257 INFO     lxc_attach - attach.c:lxc_attach:969 - Unshared cgroup namespace
                lxc 20160713183452.709 INFO     lxc_confile - confile.c:config_idmap:1500 - read uid map: type u nsid 0 hostid 1000000 range 100000
                lxc 20160713183452.709 INFO     lxc_confile - confile.c:config_idmap:1500 - read uid map: type g nsid 0 hostid 1000000 range 100000
                lxc 20160713183452.711 DEBUG    lxc_commands - commands.c:lxc_cmd_handler:893 - peer has disconnected
                lxc 20160713183452.725 DEBUG    lxc_commands - commands.c:lxc_cmd_handler:893 - peer has disconnected
                lxc 20160713183452.725 DEBUG    lxc_commands - commands.c:lxc_cmd_get_state:579 - 'francesc' is in 'RUNNING' state
                lxc 20160713183642.213 INFO     lxc_confile - confile.c:config_idmap:1500 - read uid map: type u nsid 0 hostid 1000000 range 100000
                lxc 20160713183642.213 INFO     lxc_confile - confile.c:config_idmap:1500 - read uid map: type g nsid 0 hostid 1000000 range 100000
                lxc 20160713183642.215 DEBUG    lxc_commands - commands.c:lxc_cmd_handler:893 - peer has disconnected
                lxc 20160713183642.229 DEBUG    lxc_commands - commands.c:lxc_cmd_get_state:579 - 'francesc' is in 'RUNNING' state
                lxc 20160713183642.229 DEBUG    lxc_commands - commands.c:lxc_cmd_handler:893 - peer has disconnected
                lxc 20160713183642.231 INFO     lxc_confile - confile.c:config_idmap:1500 - read uid map: type u nsid 0 hostid 1000000 range 100000
                lxc 20160713183642.231 INFO     lxc_confile - confile.c:config_idmap:1500 - read uid map: type g nsid 0 hostid 1000000 range 100000
                lxc 20160713183642.233 DEBUG    lxc_commands - commands.c:lxc_cmd_handler:893 - peer has disconnected
                lxc 20160713183642.234 DEBUG    lxc_commands - commands.c:lxc_cmd_handler:893 - peer has disconnected
                lxc 20160713183642.234 DEBUG    lxc_commands - commands.c:lxc_cmd_get_state:579 - 'francesc' is in 'RUNNING' state
                lxc 20160713183642.235 DEBUG    lxc_commands - commands.c:lxc_cmd_handler:893 - peer has disconnected
                lxc 20160713183642.235 DEBUG    lxc_commands - commands.c:lxc_cmd_handler:893 - peer has disconnected
                lxc 20160713183642.235 DEBUG    lxc_commands - commands.c:lxc_cmd_get_state:579 - 'francesc' is in 'RUNNING' state
                lxc 20160713183642.235 DEBUG    lxc_commands - commands.c:lxc_cmd_handler:893 - peer has disconnected
                lxc 20160713183642.237 DEBUG    lxc_commands - commands.c:lxc_cmd_handler:893 - peer has disconnected
                lxc 20160713183642.237 DEBUG    lxc_commands - commands.c:lxc_cmd_handler:893 - peer has disconnected
                lxc 20160713183642.237 DEBUG    lxc_commands - commands.c:lxc_cmd_get_state:579 - 'francesc' is in 'RUNNING' state
                lxc 20160713183642.238 DEBUG    lxc_commands - commands.c:lxc_cmd_handler:893 - peer has disconnected
                lxc 20160713183642.239 DEBUG    lxc_commands - commands.c:lxc_cmd_handler:893 - peer has disconnected
                lxc 20160713183642.239 DEBUG    lxc_commands - commands.c:lxc_cmd_get_state:579 - 'francesc' is in 'RUNNING' state
                lxc 20160713183642.239 DEBUG    lxc_commands - commands.c:lxc_cmd_handler:893 - peer has disconnected
                lxc 20160713183642.240 DEBUG    lxc_commands - commands.c:lxc_cmd_handler:893 - peer has disconnected
                lxc 20160713183642.241 DEBUG    lxc_commands - commands.c:lxc_cmd_handler:893 - peer has disconnected
                lxc 20160713183642.241 DEBUG    lxc_commands - commands.c:lxc_cmd_get_state:579 - 'francesc' is in 'RUNNING' state
                lxc 20160713183642.241 DEBUG    lxc_commands - commands.c:lxc_cmd_handler:893 - peer has disconnected
                lxc 20160713183642.242 DEBUG    lxc_commands - commands.c:lxc_cmd_handler:893 - peer has disconnected
                lxc 20160713183642.242 DEBUG    lxc_commands - commands.c:lxc_cmd_handler:893 - peer has disconnected
                lxc 20160713183642.242 DEBUG    lxc_commands - commands.c:lxc_cmd_get_state:579 - 'francesc' is in 'RUNNING' state
                lxc 20160713183642.243 DEBUG    lxc_commands - commands.c:lxc_cmd_handler:893 - peer has disconnected
                lxc 20160713183642.243 DEBUG    lxc_commands - commands.c:lxc_cmd_handler:893 - peer has disconnected
                lxc 20160713183642.243 DEBUG    lxc_commands - commands.c:lxc_cmd_get_state:579 - 'francesc' is in 'RUNNING' state
                lxc 20160713183642.244 DEBUG    lxc_commands - commands.c:lxc_cmd_handler:893 - peer has disconnected
                lxc 20160713183642.245 DEBUG    lxc_commands - commands.c:lxc_cmd_handler:893 - peer has disconnected
                lxc 20160713183642.245 DEBUG    lxc_commands - commands.c:lxc_cmd_handler:893 - peer has disconnected
                lxc 20160713183642.245 DEBUG    lxc_commands - commands.c:lxc_cmd_get_state:579 - 'francesc' is in 'RUNNING' state
                lxc 20160713183642.246 DEBUG    lxc_commands - commands.c:lxc_cmd_handler:893 - peer has disconnected
                lxc 20160713183642.247 DEBUG    lxc_commands - commands.c:lxc_cmd_handler:893 - peer has disconnected
                lxc 20160713183642.254 DEBUG    lxc_commands - commands.c:lxc_cmd_handler:893 - peer has disconnected
                lxc 20160713183642.254 DEBUG    lxc_commands - commands.c:lxc_cmd_handler:893 - peer has disconnected
                lxc 20160713183642.254 DEBUG    lxc_commands - commands.c:lxc_cmd_get_state:579 - 'francesc' is in 'RUNNING' state
                lxc 20160713183642.254 DEBUG    lxc_commands - commands.c:lxc_cmd_handler:893 - peer has disconnected
                lxc 20160713183642.254 DEBUG    lxc_commands - commands.c:lxc_cmd_handler:893 - peer has disconnected
                lxc 20160713183642.255 DEBUG    lxc_commands - commands.c:lxc_cmd_handler:893 - peer has disconnected
                lxc 20160713183642.256 DEBUG    lxc_commands - commands.c:lxc_cmd_handler:893 - peer has disconnected
                lxc 20160713183642.256 DEBUG    lxc_commands - commands.c:lxc_cmd_get_state:579 - 'francesc' is in 'RUNNING' state
                lxc 20160713183642.256 DEBUG    lxc_commands - commands.c:lxc_cmd_handler:893 - peer has disconnected
                lxc 20160713183642.256 DEBUG    lxc_commands - commands.c:lxc_cmd_handler:893 - peer has disconnected
                lxc 20160713183642.257 DEBUG    lxc_commands - commands.c:lxc_cmd_handler:893 - peer has disconnected
                lxc 20160713183642.257 DEBUG    lxc_commands - commands.c:lxc_cmd_handler:893 - peer has disconnected
                lxc 20160713183642.257 DEBUG    lxc_commands - commands.c:lxc_cmd_get_state:579 - 'francesc' is in 'RUNNING' state
                lxc 20160713183642.258 DEBUG    lxc_commands - commands.c:lxc_cmd_handler:893 - peer has disconnected
                lxc 20160713183642.258 DEBUG    lxc_commands - commands.c:lxc_cmd_handler:893 - peer has disconnected
                lxc 20160713183642.258 DEBUG    lxc_commands - commands.c:lxc_cmd_get_state:579 - 'francesc' is in 'RUNNING' state
                lxc 20160713183642.259 DEBUG    lxc_commands - commands.c:lxc_cmd_handler:893 - peer has disconnected
                lxc 20160713183642.260 DEBUG    lxc_commands - commands.c:lxc_cmd_handler:893 - peer has disconnected
                lxc 20160713183642.261 DEBUG    lxc_commands - commands.c:lxc_cmd_handler:893 - peer has disconnected
                lxc 20160713183642.261 DEBUG    lxc_commands - commands.c:lxc_cmd_get_state:579 - 'francesc' is in 'RUNNING' state
                lxc 20160713183642.261 DEBUG    lxc_commands - commands.c:lxc_cmd_handler:893 - peer has disconnected

**Comment by stgraber** [comment]
Ok, so a few things:
 - With macvlan, a container will not be able to talk to its host. It doesn't appear to be what you're doing though, but just something to keep in mind.
 - With macvlan or straight bridges, the container MAC address will be exposed to the switch the host is connected to. This may be a problem if your switch or virtual switch does MAC filtering. This can happen with some enterprise switches or more commonly, with some virtualization platforms like VMWare or OpenStack.
 - What you're seeing could be explained by a MAC address conflict on the host too. If you're lucky, this may result in log entries in dmesg.

**Comment by jdavid** [comment]
Thank you from your support.

This configuration actually works with LXC, that's why I opened the issue.
Maybe there is something different in LXC and LXD.

- With LXC (and macvlan) ping actually works from the host. The packets leave
  the host and then they are sent back, that's what tcpdump shows.

- The IP address is a failover IP with a virtual MAC address
  (https://documentation.online.net/en/dedicated-server/network/ip-failover/virtual-mac).
  I understand exposing the MAC address to the switch is intended in this
  case.

- The only related messages I see in dmesg, at container startup, are:

      systemd-udevd[21457]: Could not generate persistent MAC address for mc5LE49F: No such file or directory
      systemd-udevd[21457]: Process 'net.sh mc5LE49F start' failed with exit code 1.

  But I get the same messages with LXC and it works there.

  While pinging there is nothing in dmesg.

I understand now it is the gateway who is not replying to the ARP request.
Follows a more detailed tcpdump log.

- 00:c8:8b:e2:6c:45 is the MAC address of the gateway
- 52:54:00:00:4c:18 is the virtual MAC address of the macvlan interface associated to the container

With LXC, pinging from the outside:

    # tcpdump -n host 62.210.9.50 -e
    dropped privs to tcpdump
    tcpdump: verbose output suppressed, use -v or -vv for full protocol decode
    listening on enp1s0f0, link-type EN10MB (Ethernet), capture size 262144 bytes
    12:18:04.173339 00:c8:8b:e2:6c:45 > 52:54:00:00:4c:18, ethertype IPv4 (0x0800), length 98: 79.108.175.160 > 62.210.9.50: ICMP echo request, id 6744, seq 1, length 64
    12:18:04.173362 52:54:00:00:4c:18 > ff:ff:ff:ff:ff:ff, ethertype ARP (0x0806), length 42: Request who-has 163.172.33.1 tell 62.210.9.50, length 28
    12:18:04.173971 00:c8:8b:e2:6c:45 > 52:54:00:00:4c:18, ethertype ARP (0x0806), length 60: Reply 163.172.33.1 is-at 00:c8:8b:e2:6c:45, length 46
    12:18:04.173984 52:54:00:00:4c:18 > 00:c8:8b:e2:6c:45, ethertype IPv4 (0x0800), length 98: 62.210.9.50 > 79.108.175.160: ICMP echo reply, id 6744, seq 1, length 64

And with LXD:

    # tcpdump -n host 62.210.9.50 -e
    dropped privs to tcpdump
    tcpdump: verbose output suppressed, use -v or -vv for full protocol decode
    listening on enp1s0f0, link-type EN10MB (Ethernet), capture size 262144 bytes
    12:20:12.152113 00:c8:8b:e2:6c:45 > 52:54:00:00:4c:18, ethertype IPv4 (0x0800), length 98: 79.108.175.160 > 62.210.9.50: ICMP echo request, id 6754, seq 1, length 64
    12:20:12.152134 52:54:00:00:4c:18 > ff:ff:ff:ff:ff:ff, ethertype ARP (0x0806), length 42: Request who-has 163.172.34.1 tell 62.210.9.50, length 28
    12:20:13.148852 52:54:00:00:4c:18 > ff:ff:ff:ff:ff:ff, ethertype ARP (0x0806), length 42: Request who-has 163.172.34.1 tell 62.210.9.50, length 28

**Comment by stgraber** [comment]
What macvlan mode are you using with LXC?

LXD uses the bridge mode of the macvlan driver.

**Comment by jdavid** [comment]
bridge, this is the conf

    lxc.network.type = macvlan
    lxc.network.macvlan.mode = bridge
    lxc.network.link = enp1s0f0
    lxc.network.flags = up
    lxc.network.hwaddr = 52:54:00:00:4c:18
    lxc.network.ipv4 = 62.210.9.50/32
    lxc.network.ipv4.gateway = 163.172.33.1

**Comment by jdavid** [comment]
PEBCAK

Sorry for wasting your time, and thanks.
