### ISSUE TITLE
lxd downloads dozens of MB silently

### ISSUE THREAD

**Issue by asarubbo** [lxc/lxd#3992]
* Distribution: Gentoo
 * Distribution version: Latest stable
 * The output of "lxc info" or if that fails:
   * Kernel version: 4.9.49
   * LXC version: 2.0.8
   * LXD version: 2.18
   * Storage backend in use: filesystem

# Issue description

While all containers are stopped I saw that the computer has downloaded ~400mb while I didn't launch any network operation. From netstat I saw one connection like:
```
# netstat -tupan | grep lxd
tcp        0      0 192.168.35.4:60408      91.189.88.37:80         ESTABLISHED 2735/lxd
```
and tcpdump says:

```
21:10:23.333719 IP 192.168.35.4.60408 > naiad.canonical.com.http: Flags [.], ack 2231424, win 12565, options [nop,nop,TS val 24070274 ecr 239750082], length 0
21:10:23.357014 IP naiad.canonical.com.http > 192.168.35.4.60408: Flags [.], seq 2231424:2232672, ack 1, win 235, options [nop,nop,TS val 239750082 ecr 24067222], length 1248: HTTP
21:10:23.372165 IP naiad.canonical.com.http > 192.168.35.4.60408: Flags [.], seq 2232672:2233920, ack 1, win 235, options [nop,nop,TS val 239750088 ecr 24067260], length 1248: HTTP
```

What lxd is trying to do?

I saw this process two times but I don't know if it happened in the past too.

**Comment by stgraber** [comment]
LXD auto-updates images by default. There's a "lxd init" question which asks you specifically about that during initial setup.

If you pick the defaults, LXD will automatically update any image that was cached so long as that image has seen some kind of use over the past 10 days.

**Comment by stgraber** [comment]
The config keys controlling this are:

 - images.auto_update_cached (defaults to true, if false LXD will only update images that you directly mark)
 - images.auto_update_interval (in hours, how often to update images. If 0, never).
 - images.remote_cache_expiry (in days, controls after how many days an automatically cached image should be automatically removed from the image store)

(taken from doc/server.md)
